title,category
 뉴스큐  민주당  레드팀 은 지금 이것에 주목    조응천 상황실장,Politics
홍준표  초교 반장선거도 아니고 대선 왜 이리 저급한가 ,Politics
민주당  내달  최대   조 추경  추진 여야 합의는 불발 종합 ,Politics
공군 F  E 전투기 추락 조종사 끝내 순직,Politics
 정성호  멸공비판 불매운동 중단해야 음모 말려드는 일 ,Politics
 주도 법사위   벤처 차등의결권  두달 묵혔다  상원  논란 부활   요구도 묵살,Politics
F   전투기 경기 화성에 추락 조종사 순직,Politics
   마하          속력 올려  극초음속 아니다   에 과시,Politics
홍준표  초교 반장선거도 아니고 대선 왜 이리 저급한가 ,Politics
    등   미사일 규탄 에 빠진     외교부  다양한요소 고려 ,Politics
젠더정책 속도 심상정  임신 결정부터 양육까지 돌봄 혁명 ,Politics
 속보  추락 F  E 전투기 조종사 순직  엔진화재 경고등 켜져 ,Politics
카자흐 발묶인 아시아나 승객   일 귀국길   여명 예상 종합 ,Politics
 속보  정당법 개정안 본회의 통과   세부터 정당 가입 가능,Politics
    개국   규탄성명 불참 외교부  다양한 요소 고려   종합 ,Politics
이재명  휴먼 캐피털 제도로    만명 디지털 미래 인재 양성할 것   뉴시스Pic ,Politics
범죄 진압하다 피해 입혀도 면책 경찰직무집행법 본회의 의결,Politics
    호 참모  장예찬  과거  식용 제외한 지구상 모든 동물 사라졌으면 ,Politics
  미래경제위  매년 소멸되는 포인트 마일리지      억 원 돌려준다 ,Politics
 생각해본 적 없어  야권 단일화에 선 그은 안철수,Politics
멸공 논란에 불매운동까지 정용진  나는 이제 그만 ,Politics
이번 대선  고   명 중  명이 투표한다 정당 가입도      세,Politics
 속보   고 도 정당 가입  정당법  국회 본회의 통과,Politics
 출산땐     만원 임대료는             민생카드 로 반격,Politics
윤석열의  심쿵시리즈   하늘의 응급실 늘리겠다 ,Politics
 속보  F  E 사고 전투기 조종사 순직,Politics
 영상 오늘도  멸공  진화한    멸공 해시태그 단 적 없다 ,Politics
윤석열  방역 패스  무리한 측면 많아 환기 등급제 필요 ,Politics
끝내 탈출 못하고 추락 전투기 조종사 순직,Politics
영상 NFT 발행한 김동연     블록체인 기술 통해 도약해야 ,Politics
한미 북핵수석대표 유선협의  확고한 연합 방위태세 강조 ,Politics
추락한 F   조종사 순직  엔진 화재 경고등  기수 급강하 ,Politics
 사사건건    배은심 여사 조문 위해 광주 찾은 대선 후보들,Politics
F  E 전투기  대 추락 조종사 심 모 대위 순직,Politics
이재명    일 중견 중기 대표들과 간담회 산업자원분야 정책 발표,Politics
이재명  디지털 인재    만명 육성    교육비 선지원  휴먼캐피털  도입,Politics
나경원  멸공 논란  민주당 과민반응  공산당 싫어요  말 못하나 ,Politics
송영길  대장동 재판 보도  이해할 수 없는 행태 ,Politics
화성 야산서 F  전투기 추락 조종사  비상탈출 시도했지만 순직,Politics
서울시   시장 발언중지 퇴장  조례안 재의요구 결정,Politics
 비상탈출   번 외쳤지만 추락 전투기 조종사 순직,Politics
       공약  vs     만 원 부모 급여  현실 가능성은 ,Politics
 일만에 강화된 탄도미사일 쏜     희미해지는  종전선언 ,Politics
안철수  위선적  정권 심판해야   권력 축소형 대통령 개헌할 것 ,Politics
윤호중  윤석열   선제타격론 취소해야  이렇게 대놓고 군사행동 얘기한 후보 없어 ,Politics
추락 전투기 조종사 순직 F  E  사고 잦은 노후 기종  종합 ,Politics
민주 국힘  토론회 실무회의 결렬 놓고 서로  네 탓  공방,Politics
환경부    년 갈등 해소 위한  낙동강 맑은 물 공급 방안  차질 없이 이행 ,Politics
 영상   단일화   여가부 폐지   멸공 논란  윤석열 최근 주요 이슈 답변,Politics
민주당  김만배 주장  제소 방침 김은혜  언론 재갈  정권교체 이유 분명 ,Politics
야권 단일화 향방은  안철수  관심 없다  vs 윤석열  국민이 판단 ,Politics
이재명  차별금지법 제정되는 게 맞다 국민적 논의 요청 ,Politics
전용기  진중권     스피커 로 전락 멸공 비판도 자유인데 왜 흥분  ,Politics
카자흐스탄 계류 아시아나항공 귀국추진   외교부    일 출발 ,Politics
이재명   성남시 방침  발언에  정치적 마녀사냥하는 느낌 ,Politics
 전략기술 외국 유출 막는다  반도체특별법 국회 통과,Politics
 주목     대선공약   낡은 규제 혁신  스타트업 천국 만들겠다 ,Politics
안철수 뜨자 김동연에 눈독들이는 민주당,Politics
    이재명 지시  발언에  정치적 마녀사냥 검찰 정치 개입 ,Politics
윤호중   북한 선제타격 해 막자 는 윤석열  충격적 ,Politics
 멸치  콩으로 논란 겪은 윤석열   해시태그 달아본 적 없다 ,Politics
윤석열  방역패스 취지 이해 못할 바 아니지만 비과학적이고 무리한 측면 많아   뉴시스Pic ,Politics
 일만에 강화된 탄도미사일 쏜     희미해지는  종전선언 ,Politics
윤석열  지하철은 방역패스 안 하는데 마트 백화점은 이해 안 가 ,Politics
심상정  멸공  논란  에  이데올로기 편승     에겐  부럽다 ,Politics
간호계 의료계 충돌 중인데 이재명  간호법 제정 적극 추진 ,Politics
윤석열  만원 버스 지하철 두고 마트 백화점에만  방역패스   비과학적 ,Politics
여야   월 임시국회 합의 불발  민주당  단독 소집요구서 제출할 것 ,Politics
북 탄도미사일  속도 마하    극초음속 가능성 엿새전보다 진전 종합 ,Politics
구윤철  예산 분리  기재부 힘 빼려다 더 세질 수 있다 ,Politics
이재명  검찰  이상한 정보 흘려    정치적 마녀사냥 ,Politics
 e법안 프리즘 권은희  동학개미 울린  기업사냥꾼  처벌 강화해야 ,Politics
구윤철  이재명  기재부 쪼개기 에  힘 빼려다 더 세질 수도 ,Politics
송영길     정권교체 대안 어려워  석 미니정당의 한계 ,Politics
이재명   강 경제대국 vs 윤석열  성장동력 확보   경제전쟁 본격화,Politics
윤석열  임대인 정부가 임대료  분의  부담     조 재원 마련 방법은 ,Politics
북한  최대속도 마하    미사일 발사 합참  엿새보다 진전 ,Politics
윤석열    선제타격  발언에    멸공 아니라 다 죽어 ,Politics
  신현영   방역패스  논란에  법원판결 뒤 대안 마련 ,Politics
지하철 임산부석 앉은 이재명  이런 치명적인 실수를    ,Politics
민주   이재명 지시  보도 언중위 선관위 제소  선거 영향  종합 ,Politics
나경원      멸공 논란  과민반응 왜 공산당 싫다고 말 못해 ,Politics
 최영일의 시사본부  노영민  황교안 권한대행 시절  박근혜 책상 의자 반입 요구 임기 끝까지 거부 참 모질게 해 ,Politics
합참    발사체   일 전보다 진전된 탄도미사일 추정 ,Politics
     안만난다 는데  단일화 쉽지않다  각본부터 쓰는  ,Politics
이재명   열린민주당과의 대통합 무능정치와 결별 ,Politics
 반도체특별법  국회 통과 정부  백신  차전지 분야 지원,Politics
   디지털 인재    만       부모 급여 월    만 원 ,Politics
단일화 압박 커질수록 권은희의  입 에 주목,Politics
민주  추경  내달 공식선거운동 시작전 처리 전국민 여력안돼  종합 ,Politics
민갑룡  경찰청장  조종묵  소방청장  행  안전전문가 영입 ,Politics
이재명  대장동 의혹에  사소한 걸로 왜곡 시도 정치적 마녀사냥 ,Politics
여야  추경 처리  임시국회 협상 결렬 민주  소집요구서 곧 제출 ,Politics
안철수  단일화 관심 없다  국민의힘도 개혁 대상 ,Politics
김만배  이재명 지시  발언에    정치적 마녀사냥 ,Politics
 대선 말말말   남녀갈등 편승해 격화   해시태그 달아본적 없어 ,Politics
문대통령  구미형 일자리로 배터리 산업 생태계 전반 강화 ,Politics
안철수  난 국민통합 가능한 유일한 후보 단일화 없다 ,Politics
 대통령  구미형 일자리  배터리 산업 강화 계기로 ,Politics
반도체 등 첨단산업 육성  반도체특별법  본회의 처리 상보 ,Politics
  월 국회  합의 불발    추경 시급  vs    당정 합의 먼저 ,Politics
나경원      멸공 논란  과민반응 왜 공산당 싫다고 말 못해 ,Politics
 반도체 지원 특별법  국회 본회의 통과,Politics
윤석열이 다녀간 이마트 이수점 공교롭게도  방역 패스 서 제외됐다,Politics
장종태 대전서구청장    일 퇴임     대선 올인  전략,Politics
안보리 회의  시간만에     마하     극초음속미사일 도발,Politics
이재명  김만배측  이재명 지시  발언에  왜곡 마녀사냥 ,Politics
    선제타격  윤석열에  한반도 위기 빠뜨릴 부적절한 발언 ,Politics
김용민  동네 커피 최고  vs 정진석  별 커피 마셨다 ,Politics
화성서 F  E 전투기  대 추락  조종사 비상탈출 확인중 ,Politics
안철수   정부는  정치방역   코로나 특별회계 조성해야 ,Politics
 차별금지법 제정  이재명에  정의당  당장 입법 돌입해야 ,Politics
 반도체 특별법  국회 본회의 통과,Politics
민주   대장동 이재명 지시  편파보도 제소 에 국힘  언론 겁박 ,Politics
    개국   규탄성명 불참 외교부  다양한 요소 고려 ,Politics
고양 NH인재원 객실 코로나    안심 재택치료 지원시설 로 전환,Politics
경제 살린다면서   노동이사제 본회의 통과시킨 여야,Politics
안철수  국민연금     년이면 고갈 연금 못 받는 일 없도록 개혁해야 ,Politics
안철수  확장성 있는 후보가 정권교체 해야  자신감 피력,Politics
유시민  여가부 폐지 등 앞세운     등후보 인정한 꼴 ,Politics
여야    월 임시국회 추경 대장동 특검  합의 불발,Politics
 유혈시위  카자흐 묶인 아시아나기 모레 귀국   여명 탑승할듯 종합 보 ,Politics
  보 F  전투기 추락   조종사 수색 중 ,Politics
 누가  멸공  기획했나  묻자 윤석열  난 정치 컨설턴트 아냐 ,Politics
    멸공  윤석열 정용진 맹폭  철지난 색깔론  한심 ,Politics
공공기관 노동이사제 국회 본회의 통과,Politics
이재명은 잡스처럼  터틀넥  윤석열은 격앙된 말투 자제,Politics
안철수   당 후보가     넘은 건 김대중과 나뿐 단일화 생각 안 해 ,Politics
윤석열    선제타격론  이재명  국민이 불안해 ,Politics
공수처   캠프 이상일 전 의원 통신자료 조회,Politics
긴장고조 남측 탓으로 돌린 북한  새해 벽두부터 전운 몰고 와 ,Politics
 매년  월   일은 국가균형발전의 날 ,Politics
 더뉴스       비전 경쟁 본격화   정치권에 재등장한 아바타 ,Politics
외교부  북한 미사일에  북핵대표 협의 등 한미일 공조노력  종합 ,Politics
 더뉴스  정치권에 다시 등장한  아바타  논란,Politics
공군 수원기지 F  E 전투기 추락 비상탈출 조종사 수색,Politics
화성 야산 추락한 F  E      년 이후 국내서   대 추락,Politics
  젠더 전략  확  바뀐 계기   신지예 사퇴 후 깨달았다  전언,Politics
 정치   이재명  소확행 공약  윤석열  심쿵 약속  공약 경쟁,Politics
합참  북한 발사체   일 쏜 것보다 진전  안보리 결의 위반 즉각 중단하라  상보 ,Politics
MB           창조경제      소득주도성장  이재명은   경제 ,Politics
여야    월 임시국회 추경 대장동 특검  합의 불발,Politics
북  군의 평가절하 비웃듯  마하     날렸다,Politics
 현장영상   F   전투기 추락    조종사 탈출 여부 확인 중 ,Politics
공기관 이사회에 노조 대표 참여  노동이사제  월부터 시행  종합 ,Politics
자동차 공장 vs 폐공장 카페     신년회견 장소의 정치학,Politics
한정애 환경장관  원전 녹색분류  국민 갈등 우려 ,Politics
  대 지지율 두배로 끌어올린 윤석열  파괴력 의 방정식,Politics
 영상 대선 토론회 공방     실무논의 참석 안해  vs    공문 받은 적도 없어 ,Politics
노영민  윤석열  분노조절 못해 김종인  연기  주문도 그 때문    저격,Politics
 대선 토론  신경전 가열  실무회의 불참  vs  거짓 발표 ,Politics
민주당  윤석열    선제타격론 충격적 발언 취소해야 ,Politics
안철수  미친 집값 미친 전셋값 미친 세금    정부 완전 실패 ,Politics
이재명  열린민주 합당  민주개혁세력 대통합 완성 대도약의 시대 열 것 ,Politics
외교부  미 일  개국   미사일 규탄   불참에  다양한 요소 고려 ,Politics
윤석열  환기 잘 되는 시설엔 방역패스 미적용 검토 ,Politics
   대장동    지시  보도 제소    진중권  법정 발언도 검열  비판,Politics
김경석  대전 서구청장 출마 선언     낡은 관료행정 끝내야 ,Politics
    년생 송자호  국회의원 출마  나이 속인 이유는 ,Politics
이재명  국가 역할 확대  vs 윤석열  정부 아닌 민간 중심 ,Politics
여가부  충치 에 빗댄 원희룡   생니 뽑는 분열정치 멈춰라  박용진의 반격,Politics
MB           창조경제      소득주도성장  이재명은   경제 ,Politics
북  군의 평가절하 비웃듯  마하     날렸다,Politics
 현장영상   F   전투기 추락    조종사 탈출 여부 확인 중 ,Politics
   국힘  KBS 토론 실무협 불참  국힘  거짓 폄훼  당장 하자  종합 ,Politics
윤호중      선제타격  거론에  정말 호전적 인식수준 심각 ,Politics
 속보  국회 본회의  공공기관 노동이사제  가결,Politics
안보리 공동성명   은 했는데   안한 이유  대화 재개 모멘텀 필요 ,Politics
 엠픽  공군  F  E 이륙 중 추락 조종사 비상탈출 확인 중 ,Politics
북 탄도미사일  속도 마하    극초음속 가능성 엿새전보다 진전,Politics
공공기관에 노동이사 의무화 공공기관법 국회 본회의 통과 종합 ,Politics
 만   세부터 선거 출마  국무회의 의결,Politics
 CVID  유엔서  규탄한  개국 이 성명에 또 한국은 빠졌다,Politics
안철수    겨냥  더 좋은 대한민국 만들어야 정권교체는 수단 ,Politics
 속보  공공기관 노동이사제  국회 본회의 통과,Politics
여야   월 임시회 합의 불발    국힘 제외 소집 요구 예정 종합 ,Politics
황교안  멸공은 철 지난 구호 아냐 반공은 국시 ,Politics
 노동자 대표도 이사회 참여   공공기관 노동이사제  본회의 통과,Politics
  보 경기도 화성에 F   전투기 추락,Politics
  피격 공무원 사건  대통령기록물 지정금지 가처분 각하,Politics
공공기관 노동이사제  국회 본회의 통과,Politics
   고향  찾은  대통령  TK  배터리산업 중심으로 ,Politics
카자흐스탄에 발묶인 아시아나 비행기    일 귀국 추진,Politics
    월 임국  국민의힘 응하지 않아도 단독 소집 ,Politics
 속보  공공기관 노동이사제  국회 본회의 통과,Politics
이재명   대 대전환으로  대 강국  신경제 비전 선포,Politics
이재명  열린민주당 통합 투표  압도적 찬성  진정한 민주주의 실현할 것 ,Politics
 현장영상  안철수  이번 대선 문 정부 심판이자 정권교체의 실현 ,Politics
윤호중  문제 많은 결정  임시국회 합의 불발에   비판,Politics
송영길       석    석뿐  이재명만 입법공약 ,Politics
 공공기관 노동이사제  국회 본회의 통과,Politics
홍준표  어려울때 유일하게 도와준 이준석  그래서 고마워한다 ,Politics
백군기 용인시장  종이부시 각오로 시장 책무에 열정 쏟겠다 ,Politics
 구속 압색 때 영장 사본 교부  형사소송법 국회 본회의 통과,Politics
 속보  F   전투기  대  경기 화성시 야산 추락   조종사 수색 중,Politics
이재명   한국식 휴먼캐피털  제도 도입 디지털 인재    만 양성 ,Politics
 사면 직후 박정희 고향 간      구미형 일자리로 배터리 공급망 주도 ,Politics
윤석열   방역패스  확대 적용  비과학적 데이터 기반 정책 필요 ,Politics
안철수  국민통합할 유일 후보      동시 견제,Politics
윤석열    대통령과 다르게 할 한가지  묻자  시장원리 존중 ,Politics
안철수  더 좋은 대한민국 만들어야  정권교체 는 그 수단 ,Politics
외교부  카자흐스탄 계류 아시아나 항공편 귀국 추진  종합 보 ,Politics
   여가부는 충치  뽑아야  vs    생니 뽑는 분열정치 ,Politics
노재승  윤석열표  임대료 나눔제  일침  시장이 우스운가 ,Politics
합참   미사일 속도 마하   내외 비행거리      이상 ,Politics
김기현   대장동 특검법  불발  민주  짝퉁특검 으로 몸통 은폐 ,Politics
     극초음속 미사일  선제타격 밖엔 막을 방법 없다 ,Politics
민갑룡 전 경찰청장 등 고위직 인사  명   선대위 합류,Politics
안철수  단일화 관심 없다 권력축소형 대통령제 개헌 선호 ,Politics
이준석 손잡고  여가부 폐지  던진        지지율 반등,Politics
문 대통령  LG화학  국내유턴  격려  배터리 공급망 주도할 것 ,Politics
합참     자강도에서 발사    일 발사한 미사일보다 진전 ,Politics
홍준표  초등 반장 선거도 아니고  대선이 왜 이리 저급해졌나 ,Politics
  선대위   대장동   지시  보도 편파적    언론사 언중위 선관위 제소 ,Politics
합참   미사일  최대속도 마하    엿새 전보다 진전 ,Politics
 수도꼭지 틀어놓으세요    서울시    일  동파 경계  발령,Politics
여야   추경 편성  임시국회 소집 이견 특검 논의도  평행선 ,Politics
 멸공  논쟁 전용기  진중권에  멸공 비판도 자유인데 왜 흥분 ,Politics
김 총리  국가R D    조 시대 걸맞은 과감한 투자할 것 ,Politics
 전문  이재명     만 디지털 인재 양성    조 원 투자 ,Politics
윤석열  신년 회견 뒤 코로나 행보  환기 등급제 검토 ,Politics
송영길     좋은 공약 얘기해도 소수 정당으로 집행 못 해 ,Politics
  선대위   대장동   지시  보도 언론사 언중위 선관위 제소  종합 ,Politics
카라 박규리 전 남친  국회의원 출마 실제 나이 깜짝,Politics
홍준표   과 회동 앞두고  굴러온 돌에 참패했지만 당 원망 안 해 ,Politics
민주  추경  내달   일쯤 처리 전국민지원금 여력은 안 될 것 ,Politics
윤석열  출입제한 조치  공간 크기 환기 수준 따라 기준 달라야 ,Politics
 윤석열  이 말 듣고 웃었다  이준석과 화해 뒷이야기,Politics
윤석열   방역 패스  맹비난  비과학적이고 무리해 ,Politics
   오후  시  인 제한 완화 쉽지 않다  거리두기 재연장 가능성 커,Politics
민주당  추경  다음 달   일쯤 처리 전 국민 지원 여력 안 돼 ,Politics
 디라이브  청년층 과반  현금지원 반대   취약계층만 지원해야 ,Politics
최강욱   멸공  인증에  같잖은 것들이 같잖은 짓 ,Politics
    일 만에 또 발사      탄도미사일 추정 발사체 ,Politics
안철수  단일화에 관심없다 제가 정권교체할 것 ,Politics
민주당  소상공인 추경 처리  월 국회 열어야 국민의힘 협조 촉구 ,Politics
국민의힘   대장동 개발 이재명 방침  집중 공격,Politics
노영민   지도부   석방 반대 는 팩트  기록있다 순화시켜  모질게 이지 ,Politics
정용진 보란 듯    아듀 별다방  vs    커피 마셨다 ,Politics
 윤석열에 반말한 김건희  최순실급  송영길  결국 고발당했다,Politics
유시민  윤석열 여가부 폐지 공약은  투기적 행태    이재명 전략이 더 영악 ,Politics
서울시의회 조례안  시장발언 중지  논란에 행안부  묵묵부답 ,Politics
  NSC 긴급회의     탄도미사일 발사에  강한 유감 ,Politics
윤석열  만원버스 지하철  방역패스  미적용  마트 백화점만 적용 이해 안 돼 ,Politics
 ET뉴스픽  김동연 후보  대선출마 영상 NFT로 발행,Politics
 현장연결  이재명   휴먼캐피털  제도로 디지털 미래인재    만명 양성 ,Politics
 속보    발사체  비행거리      이상 최대속도 마하    내외,Politics
경기 화성 야산에 전투기  대 추락 조종사  명 탑승,Politics
공군  F   이륙 상승하던 중 경기 화성 야산에 추락 ,Politics
이재명 띄우기 진심 유시민  거대담론  필요 없다 ,Politics
잇따른   미사일 도발 대선 국면  북풍  부나,Politics
   미사일 규탄  불참 배경은 외교부  다양한 요소 고려 ,Politics
허소영 강원도의원  춘천시장 출마 선언,Politics
윤석열  신년 기자회견  임대료     국가가 분담 ,Politics
윤호중  국민의힘  월  추경  국회 거부 실망스러워 ,Politics
 멸공  정용진 응원 나선 가세연  스타벅스 텀블러 사재기 ,Politics
 신세계 보이콧  선언   의원들  불필요한 논쟁  당내 쓴소리도,Politics
여야   월 임시국회 합의 불발 추경에 이견,Politics
합참    미사일 사거리      이상 속도 마하      극초음속  가능성,Politics
   이재명  대장동 포함 토론하자니 뒤꽁무니       토론 회의 불참한 것은   ,Politics
윤석열     마하  이상 핵탑재 미사일 공격 징후 땐 선제타격뿐 ,Politics
이준석  안철수와 단일화 효과  큰 의미 없다 ,Politics
여수선언실천위  주철현 발의 법안 법사위 미상정에 유감 표명,Politics
이재명  열린민주당과 합당 가결에  대통합 시작 무능 정치와 결별 ,Politics
여가부  부처 명칭에  청소년  포함 방안 추진,Politics
민주당     정부 첫 경찰청장  민갑룡 등 영입,Politics
폐지론 휩싸인 여가부 부처 명칭에  청소년  포함 추진,Politics
이재명  열린민주와 통합 압도적 찬성 이제 무능 정치와 결별 ,Politics
    김건희 방지법  발의  허위이력 교원 퇴출하고 급여 환수 ,Politics
폐지론 휩싸인 여가부 부처 명칭에  청소년  포함 추진,Politics
여가부 폐지론 논란   적막흐르는 정부청사 여성가족부,Politics
윤석열  아이 낳으면  년간 월    만원 부모급여 지급  공약,Politics
폐지론 휩싸인 여가부 부처 명칭에  청소년  포함 추진,Politics
여가부  부처 명칭에  청소년  포함 방안 추진,Politics
여가부 폐지론 논란   적막흐르는 정부청사 여성가족부,Politics
폐지론 휩싸인 여가부 부처 명칭에  청소년  포함 추진,Politics
이재명  휴먼 캐피털 제도 디지털 인재    만 명 양성    월   일 ,Politics
공군  F  E 전투기 추락 조종사 비상탈출 여부 확인 중 ,Politics
여야  월 국회 합의 결렬   민주당  국민의힘이 응하지 않는다면 다른 야당과 하겠다 ,Politics
폐지론 휩싸인 여가부 부처 명칭에  청소년  포함 추진,Politics
 영상  북한  엿새 만에 또 탄도미사일 발사 유엔 안보리 겨냥 ,Politics
 대통령  구미형 일자리 공장 착공식 참석 박근혜 사면 후 첫 구미행,Politics
통일부  북 미사일 발사  한반도 평화 노력에 역행 ,Politics
유시민  젠더이슈   은 하이리스크 하이리턴  는 좀 더 영악해 ,Politics
 현장영상   이재명  휴먼 캐피털 제도   디지털 인재    만 명 양성 ,Politics
정부 긴급 NSC 상임위 개최   미사일 발사에  강한 유감 ,Politics
 이재노믹스  낸 이재명 측  소확행   건 포함 공약   개 냈다 ,Politics
 일문일답  윤석열   대통령과 차이점은  시장원리 자연의 이치 존중 ,Politics
    대 강대국 목표     출산 시 월 백만 원 ,Politics
천안함 생존병  군대 갔다온 대통령   옹호는 말 되고  ,Politics
LG화학의 유턴    세계 배터리 공급망 주도 ,Politics
더민주  안철수 맹비난  발광체가 아니라 반사체에 불과 ,Politics
 토리 아빠  윤석열  우리 강아지들 아니면   년 세월 버텨왔겠나 ,Politics
카라 박규리   남친 송자호  국회의원 출마  실제 나이 만   세 ,Politics
민주당 선대위  민갑룡 전 경찰청장 등 안전전문가  명 영입,Politics
이재명  열린민주와 합당가결에  대통합 시작 무능정치와 결별 ,Politics
문 대통령  구미형 일자리로 배터리 산업 생태계 전반 강화 ,Politics
윤석열    핵미사일 조짐 보일 땐 선제 타격밖에 ,Politics
이재명  차별금지법  국회 공론화 필요하다 ,Politics
  극초음속미사일  화성  형  추가 시험했나,Politics
 이 약속한  벤처기업법  제동    제 의 쿠팡 사태 나온다 ,Politics
   새해 두번째 탄도미사일 도발   대통령  대선 앞두고 우려 ,Politics
나경원  멸공 논란에 민주당 난리  공산당 싫다고 못 하나 ,Politics
