title,category
구미 내려간  대통령  구미형 일자리  배터리 산업 도약 전기 ,Politics
 더뉴스  북  엿새만에 다시 미사일 발사   배경은 ,Politics
노사모  이재명 지지 선언에 이상이 교수  고인 모독  가당치 않는 망언 ,Politics
 무분별 추진 초고층 주상복합 난개발 방지 ,Politics
황교안   멸공 의 돌풍 아주 신선 상쾌 멸공 횃불 들고 정권교체 ,Politics
이준석    향한 젊은 세대 지지 속도   오세훈 폭등세 와 비견 ,Politics
한국노총 찾은 심상정  노동이 주도하는 대선 함께 만들자   뉴시스Pic ,Politics
극초음속 아니라는   보란 듯       두배 더 빠른  마하    미사일 쐈다,Politics
윤석열    선제타격  언급 전작권 전환엔  능력 갖춰지면 ,Politics
진중권  여권  멸공  논란 비판  훈련소서 멸공의 횃불 안불렀냐 ,Politics
   대장동  이재명 지시  보도 제소  진중권  검열  비판,Politics
윤석열의  파격  공약  부모급여    만원  임대료 나눔제 도입 ,Politics
  에 반말하는 김건희  최순실 기시감  언급한 송영길  고발당해,Politics
외교부  카자흐스탄 계류 아시아나 항공편 귀국 추진  종합 ,Politics
갈라치기 비판 의식  윤석열       타깃 말한 적 없어 ,Politics
민주  추경  선거운동 하루 전 내달   일께 처리 ,Politics
 충치 뽑고 임플란트  vs  생니 뽑나    여가부 폐지 놓고    설전,Politics
이재명  세계  강 신경제 비전 발표 윤석열   부모급여  매월    만 원 ,Politics
 대통령  LG BCM 착공식 참석  구미형 일자리로 배터리 산업 앞설 것 ,Politics
 이재명 공약  신경제비전 선포   대 대전환으로  세계 강 경제대국  이끌겠다 ,Politics
구미 내려간  대통령  구미형 일자리  배터리 산업 도약 전기 ,Politics
 더뉴스  북  엿새만에 다시 미사일 발사   배경은 ,Politics
노사모  이재명 지지 선언에 이상이 교수  고인 모독  가당치 않는 망언 ,Politics
 무분별 추진 초고층 주상복합 난개발 방지 ,Politics
황교안   멸공 의 돌풍 아주 신선 상쾌 멸공 횃불 들고 정권교체 ,Politics
이준석    향한 젊은 세대 지지 속도   오세훈 폭등세 와 비견 ,Politics
 멸공논란 자제  청년 쓴소리 받아든    가감없이 보고하라 ,Politics
북  동해상으로 탄도미사일 추정 발사체 발사,Politics
이준석     정책 고민 상당해 주말부터 전통적 지지층 접근할 것 ,Politics
    이재명 지시받아  보도에 중재위 제소할 것 ,Politics
불매 주장 현근택  옆에 놓인 스벅 커피  약속 어긴 것 아냐 ,Politics
 집권 시  과 뭐가 가장 다를 건가  질문에    능력으로만 인재 발탁 ,Politics
민주당  대선 공식선거운동 시작 전까지 추경안 처리 ,Politics
민주당  김건희  게임산업협회 재직 기간 늘려 폴리텍대  턱걸이  임용 ,Politics
 그분은 이재명    응답하라 이재명  국민의힘  대장동 의혹 총공세,Politics
민주당  추경  월 국회 내 처리   전국민재난지원 여력 안 돼 ,Politics
 양낙규의 Defence Club 북 극초음속미사일 개발 맞나,Politics
허은아  홍남기의 경제 성과 홍보  견강부회의 새로운 경지 ,Politics
 터틀넥 무선마이크 vs 수어통역사 배치        회견 형식도 경쟁,Politics
   윤석열 측 TV 토론 협의 불참  vs    통보 받은 적 없다 ,Politics
정용진 보란 듯   김용민  동네 커피가 최고  vs   정진석  스벅 텀블러 ,Politics
윤석열  북 미사일 선제타격  발언에  전쟁하자는 거냐  비판 봇물,Politics
민주당    정부 첫 경찰청장 민갑룡 등 영입,Politics
 노컷브이   멸치  콩  올려놓고    해시태그 달아본 적 없어 ,Politics
이재명  지금이 대전환 골든타임 목표는  세계  강  경제대국 ,Politics
   구미 LG 배터리 공장 착공  공급망 경쟁 한 발 앞서 ,Politics
심상정  여성의 몸  출생을 위한 정책적 도구가 아니야 ,Politics
윤석열 공약 발표 후 나온 질문  이재명과 뭐가 다른가  ,Politics
이재명  차별금지법 제정돼야 상당히 많은 곡해 있는 듯 ,Politics
정성호     멸공에 반응 말고 네거티브 초대장 거부해야 ,Politics
민주당  새해 추경  내달   일 처리 전 국민 지원은 여력 안돼 ,Politics
청와대  NSC 상임위 긴급 소집  북한 미사일 강한 유감 ,Politics
외교부  카자흐서 발 묶인 아시아나항공    일 이륙 추진 중 ,Politics
 영상  윤석열  신년 기자회견서  아이 태어나면  년간 월    만원 ,Politics
문 대통령  중동  국서      부산월드엑스포 유치 지원,Politics
민주당 경남선대위 출범  이재명과 함께 대한민국 대전환을 ,Politics
얼마인지도 모른 채 소멸되던 마일리지   제도 개선 공약,Politics
윤석열  노동이사제 있었다면 월성원전 조기 폐쇄 가능했겠나 ,Politics
   민갑룡 전 경찰청장 영입  안전 전문가 ,Politics
 영상  멸공 질문 세차례 끈질기게 물었지만 윤석열 답은 ,Politics
 단독  국힘  여가부는 남혐부  주장에 당황한 싱글대디  난 정 반대 ,Politics
 일문일답  윤석열  방역패스  과학적 근거 부족 ,Politics
 TV토론  신경전     측 실무회의 불참     통보받은 적 없다 ,Politics
러브콜 할 땐 언제고  아바타  민주당    견제 ,Politics
민갑룡 임성남 육동한  민주당 선대위 전격 합류,Politics
카자흐스탄에 발묶인 아시아나 비행기  모레 귀항 추진,Politics
윤석열  잠재성장률   로 올리겠다 이 상태론 성장률 제로시대 올 것 ,Politics
윤석열  출생 땐  천 백만 원 임차인  임대료  분의  만 분담 ,Politics
통일부     우려스러운 행위 반복 말고 대화 나서야 ,Politics
이준석      단일화 질문에  자당 후보 당선을 위한 노력 최우선해야 ,Politics
    공공정책 수가  신설해 더 큰 의료재앙 대비 마트 방역패스  대단히 비과학적 ,Politics
이준석  지지율 상승한다  이번 주 성과로 나타날까,Politics
유시민    젠더 공약은  일베놀이  극우 청년들이 꾸미는 것 아닌가 ,Politics
윤석열  멸공 릴레이 는 이벤트  김재원  조국 민주당 비판에 일 커진 것 ,Politics
미 영 프 일 등  개국   미사일 발사 규탄 외교부  우려 공유 ,Politics
이재관 전 대전시 행정부시장  천안시장 출마 선언,Politics
윤석열   단일화  판단은 국민이   자 구도  드릴 말 없어 ,Politics
이재명  변재일 김진표 설훈 이상민 등   명 중진들  특임 본부장  임명,Politics
통일부  북한  평화 노력 역행 종전선언 여전히 필요 ,Politics
이재명  MB는 가짜 실용  난 진짜 실용 ,Politics
국가 대투자  이재노믹스   정부 선행 투자가 기업 투자 유인 ,Politics
카라 박규리 전 남친 송자호  국회의원 출마 선언  나이 깜짝 고백,Politics
이재명의      공약  언제 달성   임기 내 도달할 수치는 아냐 ,Politics
카자흐 발묶인 아시아나 항공편 곧 귀국길 외교부    일 출발 ,Politics
   출생  명당  년간 월    만원씩   부모급여  포함 공약 발표,Politics
북한  엿새 만에 또 탄도미사일 정부  강한 유감 ,Politics
재미국민 늘고 재중국민 줄고 대선에 어떤 영향 ,Politics
이재명 윤석열 맞짱토론 언제보나       일도 가능하다고 전달해 ,Politics
외교부  카자흐스탄 계류 아시아나 항공편  모레 귀국 잠정추진  종합 ,Politics
윤석열 공공기관 노동이사제 찬성 진짜 이유 ,Politics
통일부  북 잇단 발사에  한반도 평화노력 역행 대화 선택해야 ,Politics
KAIST서      일 대선 후보 초청  과학정책 대화 ,Politics
 코로나   저출생 극복  대규모 재정투입 예고한   집권 비전,Politics
  코로나   신규 추가 확진   명 발생   누적 완치     명  치료 중    명,Politics
김재원     멸공  논란 시발점은  민주당과 조국 ,Politics
문 대통령  구미에     억 투자  배터리산업 도약할 것 ,Politics
   야당이 TV토론 협의 불참      통보받은 적 없어 ,Politics
 폐공장 리모델링  카페서  변화  외친   옆엔 수어통역사,Politics
김기현  대장동 몸통은 이재명  대장동 특검법 처리해야 ,Politics
엿새 만에 미사일 쏜   윤석열   정부  평화쇼    선제타격 도 말해,Politics
김기현     대장동 포함 토론하자 하니 꽁무니 빼 당장하자 ,Politics
안보리 논의 열렸는데       일 만에 또  발 발사,Politics
   국가경영 청사진으로  안정감  부각 주력     비판도 자제,Politics
  연이은 미사일 발사에 통일부  역설적으로 종전선언 추진 필요 ,Politics
이재명  간호법 제정 적극 추진  사명감으로만 일하지 않도록 할 것 ,Politics
이재명 윤석열       동률     대 지지율 급등 미디어토마토 ,Politics
이재명   강 경제대국  윤석열  책임있는 변화  정책 비전대결,Politics
TK  구미형 일자리  찾은      일자리      개 생겨 지역 청년에 꿈 ,Politics
 강 중   강  지지율 변화 속 야권 저마다 자신감,Politics
윤호중  윤석열  멸공 논란 에  표현의 자유엔 책임도 져야 ,Politics
북한 미사일 발사에    우려   일 만에  강한 유감 ,Politics
이재명표 신경제 공약           상당히 빠른 시일내 도달할 목표 ,Politics
전세대출보증  억  억 반환보증  억   억으로 확대 종합 ,Politics
민주  추경  내달   일께 처리 전국민지원 여력은 안될것 ,Politics
이준석     정책 고민한 인상 줘 오세훈 때보다 나은 젊은 층 성적 기대 ,Politics
    신경제 로 세계  강  vs    책임 있는 변화   메가 정책  경쟁,Politics
   임대료     부모급여     만  위기 돌파 비전 내놨다,Politics
이재명 민주  대장동 외풍에 경제정책 강공 드라이브,Politics
잡스처럼 터틀넥에 무선마이크    테드 연설처럼 비전 설파,Politics
 대통령  LG BCM  배터리산업 도약 전기 마련할 것 ,Politics
이재명 민주  대장동 외풍에 경제정책 강공 드라이브,Politics
이재명  이재노믹스 메타정부 띄우며  경제대통령  부각,Politics
이재명       공약  임기내 목표 아닌 지향점  종합 ,Politics
민주당   김만배 발언  보도 매체 제소  김주하 AI 뉴스 ,Politics
이재명  신경제 비전 선포식  세계  강 경제대국으로 ,Politics
추경 불가피론 띄운    정부도 결정할 것 전국민 지원 여력 안 된다 ,Politics
    이재명 지시  증언 부각 대장동 특검법 압박,Politics
민주  안철수  MB아바타인가      단일화론도 견제,Politics
이재명  신경제 구상 발표 윤석열  출생시 부모급여 ,Politics
 TV토론 실무회의 통보받은 적 없다 는      공문 공개하며  어불성설 ,Politics
NSC    연속 미사일에  도발  규정 없이  강한 유감   대화  염두 종합 ,Politics
유럽선 중학생이면 입당  법정 연령 보다 당헌 자율,Politics
박규리와 결별  개월만에      년생  고백 송자호  국회의원 출마,Politics
민주당  추경다운 추경할 것 국세수입   조원 늘어 정부도 반대 못할 것 ,Politics
  코로나   신규확진   명   돌파감염 은   명,Politics
   대선 두 달 앞두고  보수 심장  TK 방문  일자리 창출 성과 강조,Politics
 대통령  해외로 나가지 않아도 신산업 경쟁력 키울 수 있어   종합 ,Politics
 일지 문재인 정부 출범 이후 북한의  무력도발 ,Politics
    신경제 로 세계  강  vs    책임 있는 변화   메가 정책  경쟁,Politics
   임대료     부모급여     만  위기 돌파 비전 내놨다,Politics
이준석     오세훈     지지율 폭등세에 비견 더 나은 성적 기대 ,Politics
이재명  세계  강 신경제 비전 발표 윤석열   부모급여  매월    만 원 ,Politics
이준석         지지율 급등 이젠 전통지지층 호남 공략 차례 ,Politics
안철수  NO 포퓰리즘  공약  비호감 대선  정책 승부수,Politics
윤석열 신년 회견  민주당 정부 와 각세우며   국민 중심  국가운영으로 변화 ,Politics
    사면뒤 박정희 고향 찾아  TK 배터리 산업생태계 중심될것  ,Politics
윤석열       표심 얻겠다 한 적 없어 전체 공익에 부합하는 일들 ,Politics
유시민  윤석열 겨냥  멸공 일베놀이  자 여가부 폐지    등 전략  혹평,Politics
    대 경제대국 목표      출산 부모 월    만원 ,Politics
이재명  과학기술 산업 교육 국토  대 대전환으로  대 강국  종합 ,Politics
문 대통령  경북  배터리산업 생태계 중심으로 발돋움할 것 ,Politics
 이 말에 윤석열 웃었다  이준석이 밝힌 극적 화해 비하인드,Politics
 뉴스앤이슈  이재명  세계  강 경제대국  윤석열  코로나 충격을 혁신으로 ,Politics
이준석      단일화 논의 전에 후보 당선노력이 우선 ,Politics
여가부 폐지론에 원희룡  충치 뽑아야 vs박용진  생니 뽑나 ,Politics
 멸공논란 불매운동 멈춰라   이재명 캠프 정성호 의원 호소,Politics
문대통령  구미형 일자리로 배터리 산업 생태계 전반 강화 ,Politics
 일문일답  윤석열  첫장만 청년 주택   LTV      대폭 풀어도 문제 없다 ,Politics
윤석열    극초음속미사일 도발 조짐 땐  막을 방법은 선제타격 뿐 ,Politics
북한  엿새 만에 또 탄도미사일 발사 정부  강한 유감 ,Politics
이준석     오세훈     지지율 폭등세에 비견 더 나은 성적 기대 ,Politics
   임대료 나눔제 도입  부모급여 매달    만원  종합 ,Politics
북  동해상으로 탄도미사일 추정 발사체 발사,Politics
원희룡     대장동  이재명 지시  보도 제소  당황한 자가 범인 ,Politics
   윤석열  경험없는 선장   이준석  배의 주인 행세   안철수  철새 ,Politics
이재명 vs 윤석열 다시  초접전          지지율 회복,Politics
통일부     미사일 발사 에도  유관국 대화 재개 필요 ,Politics
윤석열  성장 출산 부동산 해결 우선 ,Politics
이재명  남성이냐 여성이냐 선택 강요    거부하면 기회주의자라고 해 ,Politics
이재명  탈모 보험 적용  공약에 잇단  포퓰리즘  비판,Politics
   국힘  KBS 토론 실무협의 불참  국힘  사실 아냐  당장 하자 ,Politics
 일문일답 윤석열  이대남 표심 얻겠다 한적 없어 공익 부합 ,Politics
이준석  멸콩 릴레이 막아     지지율 돌아온다 ,Politics
  사이더   이틀 걸렸다  살짝 흘린 이준석  지지율 판세변화 어떻길래,Politics
윤석열   핵미사일   도발 가정  막을 방법은 선제타격밖에 ,Politics
권성동 독단 결정 서초갑      갈등 새 불씨 되나,Politics
윤석열  오로지 능력에 의해서만 인재 발탁 ,Politics
여권 휩쓴  스벅  불매 운동 지지자도  카드 잘랐습니다 ,Politics
윤석열 부모급여 월   만원 공약  현실성 실효성 따져봤나,Politics
    탄도  추정체 또 발사 NSC  강한 유감 ,Politics
윤석열  첫 주택 장만 청년주택  LTV    로 풀어도 문제없어 ,Politics
통일부  연이은 미사일 발사에도  종전선언 노력 계속 ,Politics
 여가부 폐지론  원희룡  충치뽑고 임플란트해야  박용진  생니 뽑나 ,Politics
   북핵  중단 시키겠다    임대료   조      만 원 부모수당 지원 ,Politics
진중권     멸공  논란에  훈련소서  멸공의 횃불  안 불렀나 ,Politics
통일부  북 잇단 발사에  한반도 평화노력 역행 대화 선택해야 ,Politics
 사실은  이재명 후보의 탈모 공약  돈은 얼마나 들까요 ,Politics
안민석   김건희 재발 방지법  발의 허위이력 교원 퇴출 급여환수,Politics
이재명  여성 남성 갈등  일부 정치인이 한쪽 편승해 격화 ,Politics
진중권  훈련소서  멸공의 횃불  안 불렀나 적당히 좀  구역질나 ,Politics
 내분 수습          업고 상승 시동 이준석  주말새 강한 반등 ,Politics
기시다 일본 총리  북한 탄도미사일 가능성  지극히 유감 ,Politics
조원진  이재명  탈모  공약 맞불  비만환자 건강보험 적용하겠다 ,Politics
김재원     멸공  논란 키운 건 민주당 조국 ,Politics
전용기  진중권 향해   멸공 무리하게 감싸   윤석열 스피커 전락 ,Politics
남부내륙철 본격 추진  김천 거제        연결  개 정거장 신설 ,Politics
윤석열  야권 단일화 판단은 국민이        타깃 표심 얻겠다 말한 적 없어 ,Politics
북한  안보리 회의 직후 또 미사일 국제사회 대응의지 시험,Politics
 공무원   초등생 에게도 간   특보 임명장 선관위  신고 다수 접수 ,Politics
  내부서 단일화 찬반론 고개  거간꾼  vs  국민 명령 ,Politics
윤석열  첫 주택 장만 청년주택  LTV    로 풀어도 문제없어 ,Politics
통일부  연이은 미사일 발사에도  종전선언 노력 계속 ,Politics
 여가부 폐지론  원희룡  충치뽑고 임플란트해야  박용진  생니 뽑나 ,Politics
   북핵  중단 시키겠다    임대료   조      만 원 부모수당 지원 ,Politics
진중권     멸공  논란에  훈련소서  멸공의 횃불  안 불렀나 ,Politics
통일부  북 잇단 발사에  한반도 평화노력 역행 대화 선택해야 ,Politics
 사실은  이재명 후보의 탈모 공약  돈은 얼마나 들까요 ,Politics
이재명  차별금지법  국회가 실질적 논의해주길 요청 ,Politics
여가부에 원희룡  충치  박용진  생니  폐지 두고 설전,Politics
이재명 선대위  민갑룡 전 경찰청장 등 차관급 인사  명 영입,Politics
안산시의회  모든 시민 대상  생활안정지원금  만원 지급  제동,Politics
NSC상임위    발사 강한 유감  북한에 대화 협력 촉구 종합 ,Politics
윤석열  임대료 나눔제 시행하겠다  부모급여도 도입 상보 ,Politics
 이중기준 철회  고수하는 북한  월까지 무력시위 강도 높일 듯,Politics
  경제  내세운 이재명  목표는 세계  강 경제대국 ,Politics
강병원   의원  명  국민의당  으로 단일화되면    년  국민의힘은 공중 분해 ,Politics
 북한 미사일  매우 유감   청와대 NSC 상임위 긴급회의 소집 상보 ,Politics
여가부 폐지론에 원희룡  충치 뽑자는 것  박용진  생니 뽑나 ,Politics
   핵탑재 마하   미사일  수도권에  분내 도달  요격 불가능 ,Politics
이한열 모친 배은심 여사 발인     광장 노제,Politics
 영상 이재명  세계 강 경제대국 위해 대전환   이재노믹스  선포,Politics
연이은   발사에 태영호  한반도 안정적     현실 보이지 않는 듯 ,Politics
윤석열  미접종자  지하철도 허용하는데 대형마트 못가는 것 의문 ,Politics
   NSC 상임위 긴급 소집     미사일 강한 유감  종합 ,Politics
투표일 기준 생일 지난 고  학생      재보선부터 출마 가능,Politics
이재명  세계  강 경제대국 지금이 대전환 골든타임 ,Politics
    극초음속 아니다 는   보란 듯 도발  미사일능력 재과시,Politics
윤석열  병사 월급    만 원  이남자  겨냥  최저임금 예외로 둘 수 없다 ,Politics
윤석열  벼랑 몰린 자영업자 위해  임대료 나눔제  도입하겠다 ,Politics
이재명   경제 비전 발표   대 대전환으로 세계  강 경제 대국 ,Politics
이재명캠프 좌장 정성호  멸공 불매운동 중단해야 투자자 손해봐선 안돼 ,Politics
 초동시각  대선승리의 바이블   적과의 동침 ,Politics
유시민     젠더이슈에 투기적 선거전략 써      로우리스크 전략 ,Politics
이재명        공약  임기 내 목표 아냐 빠른시간 도달 가능 ,Politics
윤석열  코로나 위기  기회로 삼겠다    과 단일화에는 선 그어 종합 ,Politics
윤석열  병사 봉급 인상이  이대남  포섭  공익에 부합하니 하자는 것 ,Politics
 우려   강한 유감    새해 미사일 도발에 수위 높인 정부 종합 ,Politics
 이재명 신경제  구상 발표 윤석열   가지 도전 극복 ,Politics
 예언해줌 윤석열 안철수 단일화 성사에 필요한 조건은 ,Politics
심상정     멸공 논란 에  상황 어려워지니 이데올로기 편승 ,Politics
윤석열   과 단일화  유권자인 국민들이 판단할 문제 ,Politics
박남춘   윤석열의 인천 공약  설익었다  혹평,Politics
대선 앞두고 표심 잡을 법안 줄줄이 통과 앞둬 오늘 본회의,Politics
 이재명 방침  김만배 진술로 재점화된  대장동  의혹,Politics
열정 책임감 판단력    대선 후보들의 자질을 묻는다,Politics
   김건희 방지법  발의  허위이력 교원  퇴출 급여환수 ,Politics
 무등의 아침  권은희  야권 후보 단일화는 민심에 대한 배반 호남 표심 움직이고 있다 ,Politics
 하락세 윤석열  바닥 찍었나        지지율 회복세 뚜렷,Politics
조원진  만병의 근원인 비만도 건강보험 적용할 것 ,Politics
유시민  젠더 이슈에 이재명 영악  윤석열은 투기적 행태 ,Politics
 구미형 일자리  이차전지 양극재 공장 착공 국내 최대 규모,Politics
유시민  진보진영  이재명으로 결집 아직 다 안 됐다 ,Politics
서울시 확진자 이틀 연속    명대   확산세 꺾이나,Politics
청와대  북한 미사일 발사에  강한 유감  비판 수위 높여,Politics
국민의힘 내부서 단일화 찬반론 고개  거간꾼  vs  국민 명령 ,Politics
홍남기   정부   대 경제성과 홍보    반성문커녕 국민 염장질러 ,Politics
    대 강국     책임있는 변화    새해 첫 본회의,Politics
 미상발사체에  NSC 긴급회의   강한 유감 표명 ,Politics
 전문  윤석열   부모급여 임대료 나눔제  등 공약 발표,Politics
   민갑룡 이수훈 등  정부 전직 고위 관료  명 영입,Politics
새해 두 번째   미사일 발사   NSC  강한 유감  종합 ,Politics
이재명 반박  검찰 주장하는  독소조항  개 는  이익환수조항 ,Politics
  새해 두번째 미사일에   NSC 소집  강한 유감 표명 ,Politics
 코로나   극복과 이후 대비 를 최우선 과제로 제시한 윤석열,Politics
이재명     조원 투자해  일자리    만개 창출할 것  종합 ,Politics
   대장동 공수처로    공세 고삐  토론하자니 뒤꽁무니  종합 ,Politics
 멸공  정용진에  바보들의 행진  박노자의 일침 이슈시개 ,Politics
   국힘  TV토론 실무협의 불참     통보받은 적 없다 ,Politics
 주연속 탄도미사일 쏜      NSC  강한 유감  대화 나서라 ,Politics
 속보 윤석열    핵고도화 과정 중단시켜야  현실로 인정 안돼 ,Politics
 NSC     미사일 강한 유감   조속히 대화해야 ,Politics
진중권   멸공  마음 안든다  훈련소서  멸공의 횃불  안 불렀나 ,Politics
윤석열  노동이사 있었으면 월성원전 조기폐쇄 있었겠나 ,Politics
홍준표의 깊은 한숨  저질 대선 참담 초등학교 반장 선거로 전락 ,Politics
윤석열  임대료     국가가 부담 예상 소요 재원   조 ,Politics
윤석열   대 뿐인 닥터헬기  전국 확대하겠다 ,Politics
카라 박규리 전 남친  국회의원 출마 선언  음주운전 사고  개월만에,Politics
 대통령  구미형 일자리 착공식 참석    상생 모델 성공 기원 ,Politics
NSC 상임위  북한  연초부터 연속적인 미사일 시험 발사 강한 유감 ,Politics
청 NSC  북한 미사일 발사에  강한 유감 ,Politics
이준석  안철수와 거리두기   단일화 공동정부 의미도 효과도 없다 ,Politics
정부  긴급 NSC상임위 개최    미사일 발사 강한 유감 ,Politics
강성범   멸공  논란 정용진 향해  제발 멸공 좀 부탁 ,Politics
진중권  훈련소서  멸공의 횃불  안 불렀나 억지 공격 적당히 하라 ,Politics
민주  KBS 토론 실무협의에 국힘 불참  vs 국힘  사실 아냐 ,Politics
 속보  정부  긴급 NSC상임위 개최    발사 강한 유감 ,Politics
   아이 첫돌까지 월   만원   자영업 임대료도 절반 지원 ,Politics
윤석열  병사월급 인상 여가부 폐지 사회 전체 공익에 부합 ,Politics
이재명   여가부 폐지  주장한 윤석열  극우 포퓰리즘의 형태 ,Politics
북   일 만에 또  발 발사      탄도미사일 추정 ,Politics
박주민  도청방지장치 의무화  강행 처리 시도  허인회의 꿈  대신 ,Politics
 얼토당토 않은 사과  분열의 언어    지도부  윤석열 행보 비판,Politics
유시민    캠프   여가부 폐지 멸공  일종의 일베놀이와 비슷 ,Politics
   북한의 탄도미사일 추정 발사체에  강한 유감   도발 은 안 써,Politics
이재명   이재노믹스  청사진 발표  목표는 세계  강 경제대국 ,Politics
윤석열  안철수와의 야권 단일화  국민이 판단할 문제 ,Politics
  NSC    미사일 발사 강한 유감 대화 재개 호응 촉구 ,Politics
