title,category
 속보  정부  긴급 NSC상임위 열어    발사 강한 유감 ,Politics
TV토론 신경전    국민의힘 불참 vs 당대당 협상 먼저 ,Politics
   NSC 상임위 긴급 소집     미사일 강한 유감   보 ,Politics
김용태   정부   미사일 쏴도 아무말 못하면서   논평엔 강한 유감 ,Politics
윤석열 기지개 켜나  지지율 소폭 반등         vs         vs        ,Politics
윤석열   부모급여 매월    만원  임대료 나눔제 도입하겠다   뉴시스Pic ,Politics
윤석열   멸공  논란 지적에  해시태그 달아본 적 없다 ,Politics
  NSC 상임위 개최   미사일에  강한 유감 표명 ,Politics
   거리두기 재연장 가능성 내달   일 전후 추경 처리  종합 ,Politics
NSC 긴급회의    미사일 발사 강한 유감 후속 동향 면밀 주시 ,Politics
이준석 자신감    지지율 회복 이틀 걸렸군   과 단일화 필요 없을 듯 ,Politics
젠더  세대  잘 갈라쳐봅시다,Politics
정성호   멸공 에 반응하는 건 음모에 말려드는 일 ,Politics
  강 목표  안철수   국민 통합 내각  띄우며 단일화 선 긋기,Politics
윤석열  벼랑끝 자영업자 위해  임대료 나눔제  도입 예상 재원   조 ,Politics
이재명  세계  대 경제대국  목표     조원 디지털 전환 투자  이재노믹스 ,Politics
이재명   이재노믹스 로 간다 종합국력 세계  강의 경제대국 ,Politics
유시민     약아서 젠더 이슈 발 빼    단일화 이기기 어려워 ,Politics
 뉴스  PICK 이재명  신경제 비전 선포  세계  강 경제대국 만든다 ,Politics
  극초음속 미사일 또 발사 가능성 마하    초과 주목,Politics
원희룡  대장동    지시  보도 제소  당황한 자가 범인 ,Politics
유시민  이재명  정부 갈라치기 보도 그만하시라 ,Politics
중앙재난안전대책본부 코로나   브리핑   월   일 ,Politics
김용태   정부   미사일 쏴도 아무말 못하면서   논평엔 강한 유감 ,Politics
   다음달   일 전후 추경 처리 야당 반대 없을 것 ,Politics
 잠시도 늦춤 없이  방위력 강화 천명한    무력시위 가속페달,Politics
조국     왜 이수 이마트서 멸콩   이준석  할인카드 있나 보지 ,Politics
신현영  코로나 미접종자 페널티 아닌 접종 독려 방식으로 가야 ,Politics
 전문 윤석열  아이 태어나면  년간 월    만원 전국민 부모급여 도입 ,Politics
이재명  금리인상  한국 부동산 시장 큰 충격  전망,Politics
 종합     엿새 만에 또  쾅  대선정국 안보리 회의 속  마이웨이 ,Politics
북한  탄도미사일 추정 발사체 발사    새해 들어 두 번째,Politics
 대통령  구미형 일자리 공장 착공식 참석  국가균형발전  일환,Politics
 박규리 전 남친  송자호  국회의원 출마 알고보니   년생,Politics
장예찬  여가부 박살내야     류호정  윤석열부터 다시 시작해야 ,Politics
국내 최대 이차전지  구미형 일자리  찾아간    적극 지원 ,Politics
  강 목표  안철수   국민통합 내각  띄우며 단일화 선 긋기,Politics
민주     지시  보도 언중위 선관위 제소  선거에 영향 ,Politics
김기현  토론하자던 이재명  대장동 포함 하자니 꽁무니 빼 ,Politics
이재명  신   경제 목표는 종합 국력 세계  강 지금이 대전환의 골든타임 ,Politics
유시민  젠더이슈에 이재명 후보가 더 영악하게 대처 ,Politics
 NO 정용진   정성호  멸공도 불매도 중단하자 국익 손해  음모론 개입 ,Politics
   한줄공약의 가벼움  멸콩  희화화   대충 윤석열  맹공,Politics
윤석열  잠재성장률        배로 올리겠다 ,Politics
이준석  멸공  내가 했겠나 후보 눈에 들려는 의원들이 일 키워 ,Politics
이재명    겨냥  일부 정치인들 남녀갈등 편승 정치 기능은 통합 ,Politics
민주당  단   자 공약  간 보는 야당과 결 달리할 것 ,Politics
북  엿새만에 다시 미사일 발사  왜,Politics
   공식선거운동 직전인  월  일 전후  추경 처리할 것 ,Politics
 과 앙숙 이준석  단일화 효과 없다  여론조사  반등 어떻길래,Politics
문 대통령  구미형 일자리 공장 착공식 상생 모델 성공 격려,Politics
이재명  신경제 비전 선포   세계  강 경제대국 과학강국 만들겠다   뉴시스Pic ,Politics
   박근혜 사면하고 박정희 고향 찾아 구미서  번째 상생형 일자리 행보,Politics
 현장연결  이재명  신경제 비전 발표  새로운 경제성장  강조,Politics
이준석  정권교체 안 되면 집에 갈 사람은 윤석열과 나밖에 ,Politics
안보리 입장 전한 외교부    미사일 우려   대화복귀 촉구 ,Politics
윤호중  윤석열 멸치 콩  표현의 자유  운운 책임 없는 자유 없어 ,Politics
이재명  경부선 지하화 공약  부산 등 도심철도 지하화 ,Politics
 전문  이재명  과학기술 산업 교육 국토 대전환  세계  대 강국 될 것 ,Politics
윤석열  자영업자 임대료  분의  국가가 부담하겠다 ,Politics
김기현   몸통은 이재명  법정 진술 나와  은폐수사  검찰 한심 ,Politics
이재명  신경제  비전 발표  목표는 종합국력 세계  강 경제대국 ,Politics
젠더 노동 의료복지 심상정   광폭 정책행보 로 지지율 반등 노린다,Politics
김부겸  군위군  대구시 편입은 광역단체 간 상생 모범 사례 ,Politics
  선대위  김만배 변론 중    지시 는 틀린 표현   성남시 공식 방침 이 맞다 ,Politics
민주당  추경  내달   일 전후 국회 처리 정부안 준비되면 바로 논의 ,Politics
 최대   조 추경  설 이후로     월 임시국회서 처리 ,Politics
 전문  이재명  디지털 인재    만명 양성한다,Politics
김기현  대장동 특검법 처리 촉구  민주당  오늘이라도 끝장토론해야 ,Politics
이재명   대 전환 으로  세계  강 도약하겠다          신경제 비전 선포,Politics
윤석열  전 국민 부모급여 도입 출생시  년간 월    만원 지급 ,Politics
이재명   정부  지원 취업  상환  휴먼캐피털 제도 공약,Politics
 국민의힘 불참했다 는    방송서 날짜 통보 안받았다 는  ,Politics
김만배 변호인이 한 말인데     이재명 지시  보도 선관위 제소,Politics
윤석열  안철수와 단일화에  유권자인 국민이 판단할 문제 ,Politics
이재명  주가조작시 원스트라이크 아웃제 도입 ,Politics
엿새만에 또 미사일 발사한      평가절하에 격분했나,Politics
윤석열 신년 기자회견  임대료 나눔제 매달    만원  부모급여  지급  상보 ,Politics
윤석열  임대료  임대인 임차인 국가가  분의  씩 고통 분담 ,Politics
진중권  훈련소서  멸공의 횃불  부를 때 항의했나  적당히 좀 ,Politics
윤호중  추경   전전정  원칙으로 사각지대 세심히 돌볼 것 ,Politics
 이 왜 내 통신조회를  연말연시  나 를 취재해 보니,Politics
 현장연결  윤석열  신년 기자회견  진심 변화 책임 ,Politics
김부겸  군위군  대구시 편입은 광역단체 간 상생 모범 사례 ,Politics
멸공 논란  스벅 불매로 번지자  정성호  자제하자 ,Politics
이재명  초광역 메가시티 고속철도 재편  국토 대전환,Politics
강병원  안철수는 반사체   희화화된 이미지  못 바꿔 ,Politics
윤석열  포스트 코로나 대응위 구성 단일화  국민 판단할 문제 ,Politics
윤석열  방역패스  과학적 근거 부족해 ,Politics
김총리  소방관 순직에 책임 통감 기존 대책 전면 재점검 ,Politics
윤석열  여가부에 기대한 역할 제대로 못했다고 판단 ,Politics
유시민  멸공 퍼포먼스로   이탈층 돌아온다  유치한 망상 ,Politics
윤석열  아이 태어나면  년간 월   만원씩  부모급여   공약,Politics
대전시   대 하천 걷기 좋은 건강걷기  개 코스 선정 발표,Politics
 이슈앤 직설  대선 두 달 앞으로 여야   대장동 특검  추진할까 ,Politics
김총리  평택 화재  정부가 원점에서 되돌아보고 뼈저린 반성 필요 ,Politics
  대선 지면 우리 둘만 집 간다  하니 윤석열 반응이   이준석   일 봉합 뒷얘기 공개,Politics
 윤석열 안철수  누가 정권교체에 적합한가  김종인 대답은 ,Politics
정용진  광주신세계   억에 사서     억에 매각  수익률      ,Politics
김동연   고독처  신설 공약  고독사  자살 더 심각해질 것 ,Politics
이재명  과학기술   산업   교육   국토  대 대전환으로  대 강국 ,Politics
